{
  "$schema": "../schema.json",
  "name": "PairDrop",
  "port": 8182,
  "available": true,
  "exposable": true,
  "dynamic_config": true,
  "id": "pairdrop",
  "tipi_version": 29,
  "version": "1.10.10",
  "categories": ["media", "data", "utilities"],
  "description": "Local file sharing in your browser. Inspired by Apple's AirDrop",
  "short_desc": "Local file sharing in your browser. Inspired by Apple's AirDrop",
  "author": "schlagmichdoch",
  "source": "https://github.com/schlagmichdoch/PairDrop",
  "website": "https://pairdrop.net/",
  "form_fields": [],
  "supported_architectures": ["arm64", "amd64"],
  "created_at": 1691943801422,
  "updated_at": 1729872813705
}
