{
  "name": "NextGBA",
  "available": true,
  "port": 8435,
  "exposable": true,
  "dynamic_config": true,
  "id": "nextgba",
  "description": "All of your favorite gameboy games in your browser",
  "tipi_version": 6,
  "version": "0.1.0",
  "categories": ["gaming"],
  "short_desc": "Gameboy in your browser",
  "author": "meienberger",
  "source": "https://github.com/meienberger/nextgba",
  "form_fields": [],
  "supported_architectures": ["arm64", "amd64"],
  "created_at": 1691943801422,
  "updated_at": 1729872793139
}
