{
  "name": "Lobe Chat",
  "available": true,
  "port": 3210,
  "exposable": true,
  "id": "lobe-chat",
  "description": "LobeChat is an open-source, high-performance chatbot framework that supports speech synthesis, multimodal, and extensible (Function Call) plugin system.",
  "tipi_version": 222,
  "version": "1.9.1",
  "categories": ["ai"],
  "short_desc": "LLM chatbot framework",
  "author": "https://github.com/lobehub",
  "source": "https://github.com/lobehub/lobe-chat",
  "website": "https://github.com/lobehub/lobe-chat",
  "form_fields": [
    {
      "type": "text",
      "label": "OpenAI API Key",
      "required": true,
      "env_variable": "OPENAI_API_KEY"
    },
    {
      "type": "url",
      "label": "OpenAI API URL",
      "required": false,
      "env_variable": "OPENAI_PROXY_URL"
    },
    {
      "type": "text",
      "label": "Custom Models",
      "hint": "Comma separated list of model IDs",
      "required": false,
      "env_variable": "CUSTOM_MODELS"
    },
    {
      "type": "password",
      "label": "Password",
      "required": false,
      "env_variable": "ACCESS_CODE"
    }
  ],
  "supported_architectures": ["arm64", "amd64"]
}
