{
  "$schema": "../app-info-schema.json",
  "name": "Mylar3",
  "port": 8174,
  "available": true,
  "exposable": true,
  "dynamic_config": true,
  "id": "mylar3",
  "tipi_version": 3,
  "version": "v0.7.1-ls84",
  "categories": ["media"],
  "description": "Mylar3 is an automated Comic Book downloader (cbr/cbz) for use with NZB and torrents written in python.",
  "short_desc": "Mylar3 is an automated Comic Book downloader (cbr/cbz) for use with NZB and torrents written in python.",
  "author": "Mylar3",
  "source": "https://github.com/mylar3/mylar3",
  "form_fields": [],
  "supported_architectures": ["arm64", "amd64"],
  "created_at": 1691943801422,
  "updated_at": 1736983593616
}
