{
  "id": "arkanum-fh",
  "available": true,
  "port": 8153,
  "name": "Arkanum-FH",
  "description": "An opinionated VS Code distribution. Start coding remotely with a containerized editor.",
  "version": "1.8.3",
  "tipi_version": 2,
  "short_desc": "An opinionated VS Code distribution.",
  "author": "OCram85",
  "source": "https://gitea.ocram85.com/arkanum/arkanum",
  "website": "https://arkanum.dev/",
  "categories": ["development"],
  "form_fields": [
    {
      "type": "password",
      "label": "Password",
      "max": 50,
      "min": 8,
      "required": false,
      "hint": "Optional web gui password, if Password or Hashed Password is not provided, there will be no auth.",
      "env_variable": "ARKANUM_PASSWORD"
    },
    {
      "type": "text",
      "label": "Hashed Password",
      "required": false,
      "hint": "Optional web gui password, overrides Password, instructions on how to create in the App description.",
      "env_variable": "ARKANUM_HASHED_PASSWORD"
    },
    {
      "type": "password",
      "label": "Sudo Password",
      "max": 50,
      "min": 8,
      "required": false,
      "hint": "If this optional variable is set, user will have sudo access in the Arkanum terminal with the specified password.",
      "env_variable": "ARKANUM_SUDO_PASSWORD"
    },
    {
      "type": "password",
      "label": "Sudo Password Hash",
      "max": 50,
      "min": 8,
      "required": false,
      "hint": "Optionally set sudo password via hash (takes priority over SUDO_PASSWORD var). Format is $type$salt$hashed.",
      "env_variable": "ARKANUM_SUDO_PASSWORD_HASH"
    },
    {
      "type": "text",
      "label": "Default Workspace",
      "required": false,
      "placeholder": "/config/workspace",
      "default": "/config/workspace",
      "hint": "If this optional variable is set, code-server will open this directory by default (defaults to: /config/workspace)",
      "env_variable": "ARKANUM_DEFAULT_WORKSPACE"
    }
  ],
  "https": true,
  "exposable": true,
  "supported_architectures": ["arm64", "amd64"],
  "dynamic_config": true,
  "created_at": 1737116464890,
  "updated_at": 1737116464890,
  "$schema": "../app-info-schema.json"
}
