{
  "$schema": "../schema.json",
  "name": "Guacamole",
  "id": "guacamole",
  "available": true,
  "short_desc": "Clientless remote desktop gateway",
  "author": "apache",
  "port": 8854,
  "url_suffix": "/guacamole",
  "categories": ["utilities"],
  "description": "Apache Guacamole is a clientless remote desktop gateway. It supports standard protocols like VNC, RDP, and SSH",
  "tipi_version": 1,
  "version": "1.5.5",
  "source": "https://github.com/apache/guacamole-server",
  "website": "https://guacamole.apache.org",
  "exposable": true,
  "supported_architectures": ["amd64"],
  "form_fields": [
    {
      "type": "random",
      "min": 32,
      "label": "Guacamole postgres password",
      "env_variable": "GUACAMOLE_DB_PASSWORD"
    }
  ],
  "created_at": 1691943801422,
  "updated_at": 1723566283000
}
