{
  "name": "Kasm Workspaces",
  "available": true,
  "port": 8744,
  "exposable": false,
  "dynamic_config": true,
  "id": "kasm-workspaces",
  "description": "Kasm Workspaces is a docker container streaming platform for delivering browser-based access to desktops, applications, and web services.",
  "tipi_version": 4,
  "version": "1.120.20221218",
  "categories": ["utilities"],
  "short_desc": "Container streaming platform.",
  "author": "Kasm",
  "source": "https://github.com/kasmtech",
  "website": "https://www.kasmweb.com/",
  "form_fields": [],
  "supported_architectures": ["arm64", "amd64"],
  "https": true,
  "created_at": 1691943801422,
  "updated_at": 1738177463033,
  "$schema": "../app-info-schema.json"
}
